pairID,documentID,segmentID,hitType,source,target,sourceLemmatized,targetLemmatized,jaccardDistance,lengthDifference,sureAlignments,possAlignments,sourceHighlights,targetHighlights,answerSureAlignments,answerPossAlignments,answerSourceHighlights,answerTargetHighlights
XIN20041208.0137-4-3,XIN20041208.0137,4,real,Sources said the State Council approval is needed to establish non-holiday festivals .,"According to sources , the establishment of any festival that does not require a day off should be approved by the State Council .",source say the state council approval be need to establish non-holiday festival .,"accord to source , the establishment of any festival that do not require a day off should be approve by the state council .",0.7142857142857143,11,12-23 2-20 3-21 4-22 5-18 9-5 11-8 0-2 7-12 ,{},{},{},{},{},{},{}
chtb_262-3-41,chtb_262,3,real,The pebble resembles exactly like the Chinese auspicious long-life lock in size and shape .,The shape and the size of this Yuhuashi looks very much like the jade symbols often worn to represent wishes for a long life .,the pebble resembles exactly like the chinese auspicious long-life lock in size and shape .,the shape and the size of this yuhuashi look very much like the jade symbol often wear to represent wish for a long life .,0.8064516129032258,10,14-24 4-11 5-12 8-22 8-23 11-4 13-1 ,{},{},{},{},{},{},{}
chtb_305-8-23,chtb_305,8,real,He thought the documents just signed are important for good-neighborliness and friendly cooperation .,He considered that the documents signed by both are very important for enhancing the friendly neighbor relationship and cooperation between the two countries .,he think the document just sign be important for good-neighborliness and friendly cooperation .,he consider that the document sign by both be very important for enhance the friendly neighbor relationship and cooperation between the two country .,0.56,10,13-23 2-3 3-4 7-10 8-11 1-1 0-0 5-5 11-14 12-18 6-8 10-17 ,{},{},{},{},{},{},{}
BBC_URD_20070709.0013-8-4,BBC_URD_20070709.0013,8,real,"MQM 's Deputy Convener Dr Farooq Sattar said , `` In the upcoming elections , the standings of all the political parties would become clear . ''",MQM Deputy Convener Dr. Farooq Sattar said the coming election will be a decisive one .,"mqm 's deputy convener dr farooq sattar say , `` in the upcoming election , the standing of all the political party would become clear . ''",mqm deputy convener dr. farooq sattar say the come election will be a decisive one .,0.7096774193548387,11,25-15 5-4 6-5 7-6 2-1 3-2 4-3 0-0 12-8 13-9 11-7 ,{},{},{},{},{},{},{}
chtb_023-8-27,chtb_023,8,real,"Recently , a number of village and township enterprises or enterprise groups with higher science and technology and of sustainable development have been mushroomed in Fujian province .","Nowadays , there appeared a lot of enterprise groups with high technology and strong stamina .","recently , a number of village and township enterprise or enterprise group with high science and technology and of sustainable development have be mushroom in fujian province .","nowadays , there appear a lot of enterprise group with high technology and strong stamen .",0.6666666666666667,12,27-15 10-7 11-8 12-9 13-10 16-11 17-12 3-5 2-4 4-6 ,{},{},{},{},{},{},{}
VOM19981219_0700_1548-5-13,VOM19981219_0700_1548,5,real,"This year 's figure could have been even lower , if it had n't been for the strong economic performance in the first half of the year .",The figure will be much lower without a strong economic growth in the first half-year .,"this year 's figure could have be even low , if it have n't be for the strong economic performance in the first half of the year .",the figure will be much low without a strong economic growth in the first half-year .,0.6896551724137931,12,27-15 20-11 21-12 22-13 17-8 18-9 23-14 8-5 6-3 3-1 ,{},{},{},{},{},{},{}
artb_552-5-34,artb_552,5,real,The spokesman pointed out the necessity of selecting specific targets to avoid hitting innocent civilians .,"The spokesman , however , pointed out that the military strikes against terrorism should be directed at precise targets in order to avoid injuring innocent civilians .",the spokesman point out the necessity of select specific target to avoid hit innocent civilian .,"the spokesman , however , point out that the military strike against terrorism should be direct at precise target in order to avoid injure innocent civilian .",0.6666666666666667,11,15-26 13-24 14-25 0-0 1-1 2-5 3-6 10-21 11-22 12-23 9-18 8-17 ,{},{},{},{},{},{},{}
artb_013-6-16,artb_013,6,real,Syrian-Israeli peace negotiations have been frozen since January 10 .,It should be pointed out that the peace negotiations between Syria and Israel have been frozen since the tenth of January .,syrian-israeli peace negotiation have be freeze since january 10 .,it should be point out that the peace negotiation between syria and israel have be freeze since the tenth of january .,0.6363636363636364,12,9-21 3-13 4-14 5-15 6-16 1-7 2-8 8-18 7-20 ,{},{},{},{},{},{},{}
chtb_266-3-27,chtb_266,3,real,"This decision broke the stalemate , which has been lasted for nearly one year , between assistance countries and the leadership of Palestine Autonomy .",The decision broke the one-year deadlock between the supporting countries and the Palestinian leaders .,"this decision break the stalemate , which have be last for nearly one year , between assistance country and the leadership of palestine autonomy .",the decision break the one-year deadlock between the support country and the palestinian leader .,0.75,10,24-14 1-1 2-2 3-3 17-9 18-10 19-11 12-4 13-4 4-5 16-8 20-13 22-12 15-6 ,{},{},{},{},{},{},{}
chtb_023-7-24,chtb_023,7,real,Eleven village and township enterprises in this province has been listed into the `` The village and township enterprises with best economic effect and profit '' in China .,Eleven of Fujian 's TVEs have been granted the national `` Most Economically Beneficial TVE '' award .,eleven village and township enterprise in this province have be list into the `` the village and township enterprise with best economic effect and profit '' in china .,eleven of fujian 's tves have be grant the national `` most economically beneficial tve '' award .,0.7878787878787878,11,28-17 8-5 9-6 0-0 13-10 21-12 25-15 ,{},{},{},{},{},{},{}
ZBN19981210_0108-12-38,ZBN19981210_0108,12,real,"However , he vowed to implement broad reform measures and stop corruption that weakens the national economy .","However , he pledged that he will carry through the extensive reform measures , and put an end to corruption , which has weakened this country 's economy .","however , he vow to implement broad reform measure and stop corruption that weaken the national economy .","however , he pledge that he will carry through the extensive reform measure , and put an end to corruption , which have weaken this country 's economy .",0.5806451612903225,11,17-28 0-0 1-1 2-2 7-11 8-12 16-27 13-23 6-10 15-25 11-19 3-3 10-17 ,{},{},{},{},{},{},{}
PHOENIX_GOODMORNCN_CMN_20060215_185801_955_1163.qrtr-9-4,PHOENIX_GOODMORNCN_CMN_20060215_185801_955_1163.qrtr,9,real,He had supported the hawks and aggressively promoted the revision of the Constitution .,"It should be said that he has always supported the hawk faction , and he has worked hard to promote amendment of the constitution .",he have support the hawk and aggressively promote the revision of the constitution .,"it should be say that he have always support the hawk faction , and he have work hard to promote amendment of the constitution .",0.5833333333333333,11,13-24 10-21 11-22 12-23 2-8 3-9 4-10 0-5 1-6 7-19 9-20 ,{},{},{},{},{},{},{}
artb_557-2-11,artb_557,2,real,"London , October 9 /Xinhua/ British Muslim Council , today , expressed its opposition to the air strikes led by the United States against Afghanistan .",London October 9/XinhuaCouncil of British Muslims denounced today US-led air strikes against Afghanistan .,"london , october 9 /xinhua/ british muslim council , today , express it opposition to the air strike lead by the united state against afghanistan .",london october 9/xinhuacouncil of british muslim denounce today us-led air strike against afghanistan .,0.6296296296296297,12,27-13 25-11 26-12 7-4 8-5 18-9 19-10 0-0 2-1 11-7 ,{},{},{},{},{},{},{}
chtb_023-8-36,chtb_023,8,real,"Currently , Fujian Province has already produced a profusion of village and township enterprises and groups of comparatively high scientific caliber and relatively adequate development staying power .","Nowadays , there appeared a lot of enterprise groups with high technology and strong stamina .","currently , fujian province have already produce a profusion of village and township enterprise and group of comparatively high scientific caliber and relatively adequate development stay power .","nowadays , there appear a lot of enterprise group with high technology and strong stamen .",0.7575757575757576,12,27-15 15-8 13-7 18-10 0-0 26-13 1-1 ,{},{},{},{},{},{},{}
XIN20020412.0061-4-5,XIN20020412.0061,4,real,The TV station also establish a reception group of 25 to receive donors .,"In the yard of the TV station , a reception group made up by 25 people was in charge of receive people coming to make endowments .",the tv station also establish a reception group of 25 to receive donor .,"in the yard of the tv station , a reception group make up by 25 people be in charge of receive people come to make endowment .",0.56,13,13-26 0-4 1-5 2-6 5-8 6-9 7-10 4-11 9-14 11-20 ,{},{},{},{},{},{},{}
chtb_098-4-0,chtb_098,4,real,Fujian is among the most rapidly developing areas in coastal China .,Fujian is one of the coastal regions in China that have enjoyed the fastest growth in economic and trade activities with foreign countries .,fujian be among the most rapidly develop area in coastal china .,fujian be one of the coastal region in china that have enjoy the fast growth in economic and trade activity with foreign country .,0.7407407407407407,12,11-23 0-0 1-1 9-5 10-8 7-6 5-13 8-7 ,{},{},{},{},{},{},{}
urd-WL-76-174284-7596494-10-3,urd-WL-76-174284-7596494,10,real,People have started hoping that justice in the judiciary still exists and this dead horse seems alive .,"With this decision , the people came to believe that there was still justice in the courts , and the court of the people was alive and well .",people have start hop that justice in the judiciary still exist and this dead horse seem alive .,"with this decision , the people come to believe that there be still justice in the court , and the court of the people be alive and well .",0.6551724137931034,11,17-28 5-13 6-14 7-15 8-16 9-12 0-5 16-25 ,{},{},{},{},{},{},{}
XIN20020329.0061-3-4,XIN20020329.0061,3,real,Shi Guangsheng made the above statement in response to a question by a reporter while attending a working committee meeting on nation-wide economic and foreign trade legislation .,Shi Guangsheng answered questions asked by reporter at the National Workshop on Laws of Foreign Trade .,shi guangsheng make the above statement in response to a question by a reporter while attend a working committee meet on nation-wide economic and foreign trade legislation .,shi guangsheng answer question ask by reporter at the national workshop on law of foreign trade .,0.696969696969697,11,27-16 0-0 1-1 24-14 25-15 10-3 13-6 26-12 7-2 21-9 11-5 ,{},{},{},{},{},{},{}
chtb_245-4-40,chtb_245,4,real,Mclaren reiterate his support of China 's entry into GATT and WTO as a founding member .,MacRalon still reiterated his support for China to resume its position as one of the treaty states of GATT and one of the founding members of WTO .,mclaren reiterate his support of china 's entry into gatt and wto a a founding member .,macralon still reiterate his support for china to resume it position a one of the treaty state of gatt and one of the found member of wto .,0.6071428571428572,11,16-27 1-2 2-3 3-4 9-18 10-19 14-23 15-24 5-6 11-26 ,{},{},{},{},{},{},{}
urd-WL-72-174253-7786794-24-5,urd-WL-72-174253-7786794,24,real,"Smoking , tobacco use are very dangerous .","Cigar and cigarette smoking , chewing tobacco , gutka , and injecting drugs are dangerous to health .","smoking , tobacco use be very dangerous .","cigar and cigarette smoking , chew tobacco , gutka , and inject drug be dangerous to health .",0.6470588235294117,10,7-17 0-3 1-4 6-14 4-13 2-6 ,{},{},{},{},{},{},{}
ZBN19981203_0062-12-0,ZBN19981203_0062,12,real,About 35 % surveyed blamed the media for causing prejudice against the British .,About 35 % of the people interviewed blame the media as the chief culprit for making the native Australians prejudiced against the British immigrants .,about 35 % survey blame the medium for cause prejudice against the british .,about 35 % of the people interview blame the medium a the chief culprit for make the native australian prejudice against the british immigrant .,0.5217391304347826,11,13-24 9-19 10-20 11-21 12-22 0-0 1-1 2-2 4-7 5-8 6-9 3-6 ,{},{},{},{},{},{},{}
groups.google.com_kholoudalrouh_c53489b6b668d438_ARB_20060217_083000-17-0,groups.google.com_kholoudalrouh_c53489b6b668d438_ARB_20060217_083000,17,real,... it was her son ... yes him ...,And from above came to her ears a whimpering voice ... it 's her son .. yes him ...,... it be her son ... yes him ...,and from above come to her ear a whimpering voice ... it 's her son .. yes him ...,0.6666666666666667,10,8-19 6-17 7-18 0-10 1-11 3-13 4-14 2-12 ,{},{},{},{},{},{},{}
BBC_URD_20070709.0013-8-3,BBC_URD_20070709.0013,8,real,"MQM 's Deputy Convener Dr Farooq Sattar said , `` In the upcoming elections , the standings of all the political parties would become clear . ''",MQM Deputy Convener Dr. Farooq Sattar said the coming election will be a decisive one .,"mqm 's deputy convener dr farooq sattar say , `` in the upcoming election , the standing of all the political party would become clear . ''",mqm deputy convener dr. farooq sattar say the come election will be a decisive one .,0.7096774193548387,11,25-15 5-4 6-5 7-6 2-1 3-2 4-3 0-0 12-8 13-9 11-7 ,{},{},{},{},{},{},{}
ZBN20020318.0001-6-3,ZBN20020318.0001,6,real,"South Korea has accused North Korea of 12 intrusions in the West Sea areas in past year . However , none of them is of any serious nature .","ROK accused DPRK of 12 incursions into the western waters , but none was serious .","south korea have accuse north korea of 12 intrusion in the west sea area in past year . however , none of them be of any serious nature .","rok accuse dprk of 12 incursion into the western water , but none be serious .",0.7096774193548387,13,28-15 6-3 7-4 3-1 1-0 8-5 5-2 11-8 12-9 20-12 26-14 10-7 ,{},{},{},{},{},{},{}
ZBN19981119_0059-8-22,ZBN19981119_0059,8,real,Pinochet is currently in London awaiting a House of Lords decision on his extradition .,"At present , Pinouchet was in London , waiting for the House of Lords to make the decision on whether to extradite him or not .",pinochet be currently in london await a house of lord decision on his extradition .,"at present , pinouchet be in london , wait for the house of lord to make the decision on whether to extradite him or not .",0.6896551724137931,11,14-25 7-11 8-12 9-13 3-5 4-6 10-17 11-18 5-8 13-21 2-1 12-22 ,{},{},{},{},{},{},{}
artb_013-6-12,artb_013,6,real,Syrian-Israeli peace negotiations have been frozen since January 10 .,It may be mentioned here that the Syrian-Israeli peace talks have been lying in the cold storage since 10th January .,syrian-israeli peace negotiation have be freeze since january 10 .,it may be mention here that the syrian-israeli peace talk have be lie in the cold storage since 10th january .,0.6818181818181819,11,9-20 0-7 1-8 3-10 4-11 2-9 6-17 7-19 8-18 ,{},{},{},{},{},{},{}
ZBN20040219.001-9-0,ZBN20040219.001,9,real,"Similarly , China is also situated in a very special period of time when it is experiencing a high economic growth and a major transition in the society .",China is now within the same special period that sees fast economic growth and social transformation .,"similarly , china be also situate in a very special period of time when it be experience a high economic growth and a major transition in the society .",china be now within the same special period that see fast economic growth and social transformation .,0.7272727272727273,12,28-16 19-11 20-12 21-13 2-0 3-1 9-6 10-7 16-9 24-15 27-14 8-5 ,{},{},{},{},{},{},{}
urd-WL-90-174283-7720336-24-5,urd-WL-90-174283-7720336,24,real,This problem remains a struggle for devotees over what the democracy will be named .,There is also the issue of what would be gained from all of these efforts and sacrifices by those acting in the name of the democracy .,this problem remain a struggle for devotee over what the democracy will be name .,there be also the issue of what would be gain from all of these effort and sacrifice by those act in the name of the democracy .,0.8064516129032258,12,14-26 9-24 10-25 13-22 1-4 ,{},{},{},{},{},{},{}
urd-WL-90-174283-7720336-14-3,urd-WL-90-174283-7720336,14,real,Firstly Sheikh Sahab verified it then Mr. Tarique Azeem admitted that so has happened .,"First of all , it was declared by Sheikh Sahib of the Railway Ministry , then Tarique Azeem accepted that it happened the same way .",firstly sheikh sahab verify it then mr. tarique azeem admit that so have happen .,"first of all , it be declare by sheikh sahib of the railway ministry , then tarique azeem accept that it happen the same way .",0.7241379310344828,11,14-25 7-16 8-17 9-18 0-0 1-8 13-21 10-19 ,{},{},{},{},{},{},{}
ZBN19981213_0043-7-43,ZBN19981213_0043,7,real,Hui Rui was considering whether to make some ads directly mentioning Wei Ge .,"Pfizer Company is thinking over whether any other advertisements in which the product 's name , Viagra , is mentioned directly , will be needed .",hui rui be consider whether to make some ad directly mention wei ge .,"pfizer company be think over whether any other advertisement in which the product 's name , viagra , be mention directly , will be need .",0.8387096774193549,12,13-25 10-19 9-20 3-3 2-2 4-5 8-8 ,{},{},{},{},{},{},{}
chtb_232-10-41,chtb_232,10,real,The discoveries also provide new clues for seeking more dinosaur fossils .,The discovery of the dinosaur fossils also provides important hints for where researchers should look for additional fossils and how these bones fossils were buried .,the discovery also provide new clue for seek more dinosaur fossil .,the discovery of the dinosaur fossil also provide important hint for where researcher should look for additional fossil and how these bone fossil be bury .,0.6923076923076923,14,11-25 0-0 1-1 2-6 3-7 9-4 10-5 5-9 7-14 4-16 6-10 ,{},{},{},{},{},{},{}
cmn-WL-8-89514-7839502-13-0,cmn-WL-8-89514-7839502,13,real,"These people are usually straightforward people . If they like someone , they like someone , if they do n't like someone , they do n't like them .",These people are people with true temperament in general . Their likes and dislikes are real .,"these people be usually straightforward people . if they like someone , they like someone , if they do n't like someone , they do n't like them .",these people be people with true temperament in general . their like and dislike be real .,0.782608695652174,12,28-16 0-0 1-1 2-2 5-3 9-11 8-10 ,{},{},{},{},{},{},{}
ZBN19981216_0054-8-26,ZBN19981216_0054,8,real,"From the technical point of view , South and North Korea are in the status of war .",They are still technically at war .,"from the technical point of view , south and north korea be in the status of war .",they be still technically at war .,0.85,11,17-6 16-5 2-3 ,{},{},{},{},{},{},{}
AFA20030207.9120-4-3,AFA20030207.9120,4,real,This work began a short while ago . '',"`` It has been a short time since these efforts started , '' Fleischer said in a press conference .",this work begin a short while ago . '',"`` it have be a short time since these effort start , '' fleischer say in a press conference .",0.8333333333333334,11,7-19 3-4 4-5 6-7 1-9 2-10 8-12 ,{},{},{},{},{},{},{}
groups.yahoo.com_Yamuslim_9260_ARB_20060210_130300-38-4,groups.yahoo.com_Yamuslim_9260_ARB_20060210_130300,38,real,"So the Prophet , God 's prayer and peace be upon Him , said : `` Now , Omar , now . ''","The prophet said : Now , Omar , now .","so the prophet , god 's prayer and peace be upon him , say : `` now , omar , now . ''","the prophet say : now , omar , now .",0.5789473684210527,13,21-9 16-4 17-5 18-6 19-7 20-8 1-0 2-1 13-2 14-3 ,{},{},{},{},{},{},{}
groups.yahoo.com_Yamuslim_9260_ARB_20060210_130300-28-5,groups.yahoo.com_Yamuslim_9260_ARB_20060210_130300,28,real,"The prophet ( God bless Him and grant Him salvation ) said to him , `` More than your son , Umar ? ''","The Prophet replied : More than your son , Omar ?","the prophet ( god bless him and grant him salvation ) say to him , `` more than your son , umar ? ''","the prophet reply : more than your son , omar ?",0.6666666666666667,13,16-4 17-5 18-6 19-7 20-8 0-0 1-1 21-9 22-10 ,{},{},{},{},{},{},{}
ZBN20020317.0003-13-1,ZBN20020317.0003,13,real,"However , Nasdaq 's advancer/decliner ratio is 6-5 .",The ratio of rising stocks to falling stocks is 6 to 5 in the American Automatic Quotation System .,"however , nasdaq 's advancer/decliner ratio be 6-5 .",the ratio of rise stock to fall stock be 6 to 5 in the american automatic quotation system .,0.8636363636363636,10,8-18 5-1 7-9 7-11 6-8 ,{},{},{},{},{},{},{}
urd-WL-11-174273-7483769-8-1,urd-WL-11-174273-7483769,8,real,I have never liked Mullahism and have always considered Lal Masjid 's unlawful activities as fascist acts .,"I never liked mob rule , and at the same time have always considered the activities dedicated to taking over the rule of Lal Masjid as fascist activities .",i have never like mullahism and have always consider lal masjid 's unlawful activity a fascist act .,"i never like mob rule , and at the same time have always consider the activity dedicate to take over the rule of lal masjid a fascist activity .",0.5517241379310345,11,17-28 6-11 7-12 8-13 2-1 3-2 9-23 10-24 14-25 15-26 16-27 13-15 ,{},{},{},{},{},{},{}
chtb_305-8-17,chtb_305,8,real,He thought the documents just signed are important for good-neighborliness and friendly cooperation .,He understood that the documents just signed would be very important to strengthening of good neighboring relations and friendly co-operation between two countries .,he think the document just sign be important for good-neighborliness and friendly cooperation .,he understand that the document just sign would be very important to strengthen of good neighboring relation and friendly co-operation between two country .,0.6428571428571428,10,13-23 2-3 3-4 4-5 5-6 10-17 11-18 12-19 7-10 6-8 9-14 ,{},{},{},{},{},{},{}
chtb_150-4-31,chtb_150,4,real,"To resolve the problem of inadequate funding and to open doors to the outside world , Guangxi has made great efforts to attract foreign investment .",Guangxi imported large amount of foreign funds for resolving capital insufficiency and deepening open up .,"to resolve the problem of inadequate funding and to open door to the outside world , guangxi have make great effort to attract foreign investment .",guangxi import large amount of foreign fund for resolve capital insufficiency and deepen open up .,0.7741935483870968,10,25-15 16-0 19-2 1-8 5-10 6-6 9-13 23-5 24-9 4-4 ,{},{},{},{},{},{},{}
ZBN19981111_0041-9-11,ZBN19981111_0041,9,real,This is a result of the reduced U.S. export to Asia which in turn affects the investment and output in the U.S. manufacturing industry .,Reduced US exports to Asia affected investments and output of manufacturing industries .,this be a result of the reduced u.s. export to asia which in turn affect the investment and output in the u.s. manufacturing industry .,reduce u export to asia affected investment and output of manufacturing industry .,0.5833333333333333,12,24-12 8-2 9-3 10-4 16-6 17-7 18-8 22-10 23-11 7-1 6-0 14-5 ,{},{},{},{},{},{},{}
chtb_150-4-41,chtb_150,4,real,Guangxi imported large amount of foreign funds for resolving capital insufficiency and deepening open up .,"In order to solve the problem of capital shortages , and increase the level of opening up policies to outside sources , Guangxi has vigorously introduced foreign funds .",guangxi import large amount of foreign fund for resolve capital insufficiency and deepen open up .,"in order to solve the problem of capital shortage , and increase the level of open up policy to outside source , guangxi have vigorously introduce foreign fund .",0.71875,13,15-28 5-26 6-27 13-15 14-16 9-7 10-8 0-22 3-13 8-3 4-14 ,{},{},{},{},{},{},{}
chtb_076-6-30,chtb_076,6,real,These top ten covers over 91 % of all the practically utilized foreign investment in China .,"In investment in China , these top ten countries and regions account for more than 91 percent of the amount of foreign capital actually employed throughout China .",these top ten cover over 91 % of all the practically utilized foreign investment in china .,"in investment in china , these top ten country and region account for more than 91 percent of the amount of foreign capital actually employ throughout china .",0.6451612903225806,11,16-27 0-5 1-6 2-7 13-1 14-2 15-3 6-16 5-15 12-21 11-24 7-17 ,{},{},{},{},{},{},{}
cmn-NG-31-117651-7567714-21-5,cmn-NG-31-117651-7567714,21,real,The parents of some cyber-friends belong to this generation . You can chat with them .,Parents of some of our friends on the internet belong to this age group . You might do well to have a chat with them .,the parent of some cyber-friends belong to this generation . you can chat with them .,parent of some of our friend on the internet belong to this age group . you might do well to have a chat with them .,0.5384615384615384,10,15-25 12-22 13-23 14-24 1-0 2-1 3-2 5-9 6-10 7-11 9-14 10-15 ,{},{},{},{},{},{},{}
