pairID,documentID,segmentID,hitType,source,target,sourceLemmatized,targetLemmatized,jaccardDistance,lengthDifference,sureAlignments,possAlignments,sourceHighlights,targetHighlights,answerSureAlignments,answerPossAlignments,answerSourceHighlights,answerTargetHighlights
ZBN20040222.005-3-4,ZBN20040222.005,3,HITInput,The scandal has been widely reported in the Chinese media and has afforded general satisfaction .,"The Chinese domestic media , big and small , vied with one another in reporting or reprinting this scandal to the great gratification of the general public .",the scandal have be widely report in the chinese medium and have afford general satisfaction .,"the chinese domestic medium , big and small , vie with one another in reporting or reprint this scandal to the great gratification of the general public .",0.7419354838709677,12,9-3 5-14 7-0 13-25 14-22 1-18 8-1 15-27,,,,,,,
chtb_098-4-0,chtb_098,4,HITInput,Fujian is among the most rapidly developing areas in coastal China .,Fujian is one of the coastal regions in China that have enjoyed the fastest growth in economic and trade activities with foreign countries .,fujian be among the most rapidly develop area in coastal china .,fujian be one of the coastal region in china that have enjoy the fast growth in economic and trade activity with foreign country .,0.7407407407407407,12,5-13 9-5 1-1 7-6 11-23 10-8 0-0 8-7,,,,,,,
ZBN20040219.001-9-0,ZBN20040219.001,9,HITInput,"Similarly , China is also situated in a very special period of time when it is experiencing a high economic growth and a major transition in the society .",China is now within the same special period that sees fast economic growth and social transformation .,"similarly , china be also situate in a very special period of time when it be experience a high economic growth and a major transition in the society .",china be now within the same special period that see fast economic growth and social transformation .,0.7272727272727273,12,24-15 27-14 2-0 16-9 9-6 19-11 3-1 20-12 8-5 10-7 21-13 28-16,,,,,,,
artb_013-6-41,artb_013,6,HITInput,Syrian-Israeli peace talks have been frozen since January 10 .,It should be pointed out that the peace negotiations between Syria and Israel have been frozen since the tenth of January .,syrian-israeli peace talk have be freeze since january 10 .,it should be point out that the peace negotiation between syria and israel have be freeze since the tenth of january .,0.6956521739130435,12,5-15 8-18 6-16 2-8 1-7 3-13 9-21 4-14 7-20,,,,,,,
ZBN19981102_0111-8-4,ZBN19981102_0111,8,HITInput,"However , Indonesian Commander-in-chief Wiranto rebuffed it as a `` lie '' .","However , General Wiranto , commander-in-chief of Indonesia 's armed forces , said that the number of 17,000 troops is `` a lie . ''","however , indonesian commander-in-chief wiranto rebuff it a a `` lie '' .","however , general wiranto , commander-in-chief of indonesia 's armed force , say that the number of 17,000 troop be `` a lie . ''",0.64,12,8-21 4-3 0-0 2-7 1-1 3-5 10-22 11-24 9-20 12-23,,,,,,,
BBC_URD_20090120.0023-4-2,BBC_URD_20090120.0023,4,HITInput,"Meanwhile , preparations are being made in Washington for an unprecedented gathering on the occasion of the new president 's oath-taking ceremony on Tuesday .",Washington is bracing itself for unprecedented crowds arriving for Tuesday 's inauguration .,"meanwhile , preparation be be make in washington for an unprecedented gathering on the occasion of the new president 's oath-taking ceremony on tuesday .",washington be brace itself for unprecedented crowd arrive for tuesday 's inauguration .,0.7407407407407407,12,24-12 7-0 11-6 8-4 23-9 10-5,,,,,,,
cmn-WL-8-89514-7839535-19-4,cmn-WL-8-89514-7839535,19,HITInput,It has been done and I accept the setback .,"When it is done , it is done . When you fall on your face , resign yourself to the mishap .",it have be do and i accept the setback .,"when it be do , it be do . when you fall on your face , resign yourself to the mishap .",0.7619047619047619,12,2-2 8-20 3-3 9-21 7-19,,,,,,,
BBC_URD_20090103.0008-4-2,BBC_URD_20090103.0008,4,HITInput,"This research has proven wrong the old saying that `` while suffering from fever , it is better to abstain from eating . ''",The research has disproven the `` starve a fever '' adage .,"this research have prove wrong the old saying that `` while suffer from fever , it be well to abstain from eat . ''",the research have disproven the `` starve a fever '' adage .,0.7407407407407407,12,2-2 22-11 23-9 9-5 1-1 7-10 13-8,,,,,,,
ZBN19981102_0111-8-1,ZBN19981102_0111,8,HITInput,"However , Indonesian Commander-in-chief Wiranto rebuffed it as a `` lie '' .","However , the commander-in-chief of Indonesian armed force , General Wiranto , said that the number of seventeen thousand is a `` lie '' .","however , indonesian commander-in-chief wiranto rebuff it a a `` lie '' .","however , the commander-in-chief of indonesian arm force , general wiranto , say that the number of seventeen thousand be a `` lie '' .",0.5652173913043479,12,8-20 0-0 2-5 1-1 3-3 10-22 11-23 4-10 9-21 12-24,,,,,,,
urd-NG-102-174502-11516161-post53-10-5,urd-NG-102-174502-11516161-post53,10,HITInput,"The truth is that we are the first Islamic nuclear state in the world . Why do we enjoy this status , is the bone of contention .","Actually , we are the first Islamic nuclear state . That is the main conflict .","the truth be that we be the first islamic nuclear state in the world . why do we enjoy this status , be the bone of contention .","actually , we be the first islamic nuclear state . that be the main conflict .",0.5833333333333333,12,27-15 4-2 9-7 5-3 22-11 7-5 10-8 23-12 8-6 6-4,,,,,,,
urd-NG-102-174502-11516161-post69-2-4,urd-NG-102-174502-11516161-post69,2,HITInput,"In a similar way , the terrorists should be eliminated regardless of whatever region they belong to ; whether they are Pakistanis , Indians , Americans or Israelis .","All such terrorists should be finished whether they are Pakistanis , Indians , Americans or Israelis .","in a similar way , the terrorist should be eliminate regardless of whatever region they belong to ; whether they be pakistanis , indian , american or israeli .","all such terrorist should be finish whether they be pakistanis , indian , american or israeli .",0.5714285714285714,12,20-8 22-10 5-1 27-15 24-12 7-3 19-7 23-11 25-13 26-14 21-9 18-6 8-4 6-2 28-16,,,,,,,
VOM19981219_0700_1548-5-13,VOM19981219_0700_1548,5,HITInput,"This year 's figure could have been even lower , if it had n't been for the strong economic performance in the first half of the year .",The figure will be much lower without a strong economic growth in the first half-year .,"this year 's figure could have be even low , if it have n't be for the strong economic performance in the first half of the year .",the figure will be much low without a strong economic growth in the first half-year .,0.6896551724137931,12,22-13 27-15 3-1 20-11 23-14 8-5 18-9 21-12 6-3 17-8,,,,,,,
artb_557-2-33,artb_557,2,HITInput,London October 9/XinhuaCouncil of British Muslims denounced today US-led air strikes against Afghanistan .,London 9 October / Chinkhoi / Britain 's Moslems Council declared today its opposition to the air strikes led by the United States against Afghanistan .,london october 9/xinhuacouncil of british muslim denounce today us-led air strike against afghanistan .,london 9 october / chinkhoi / britain 's moslem council declare today it opposition to the air strike lead by the united state against afghanistan .,0.7333333333333334,12,0-0 10-17 4-6 1-2 5-8 7-11 11-23 13-25 12-24 9-16,,,,,,,
artb_013-6-16,artb_013,6,HITInput,Syrian-Israeli peace negotiations have been frozen since January 10 .,It should be pointed out that the peace negotiations between Syria and Israel have been frozen since the tenth of January .,syrian-israeli peace negotiation have be freeze since january 10 .,it should be point out that the peace negotiation between syria and israel have be freeze since the tenth of january .,0.6363636363636364,12,5-15 8-18 6-16 2-8 1-7 3-13 9-21 4-14 7-20,,,,,,,
BBC_URD_20090120.0023-4-2,BBC_URD_20090120.0023,4,HITInput,"Meanwhile , preparations are being made in Washington for an unprecedented gathering on the occasion of the new president 's oath-taking ceremony on Tuesday .",Washington is bracing itself for unprecedented crowds arriving for Tuesday 's inauguration .,"meanwhile , preparation be be make in washington for an unprecedented gathering on the occasion of the new president 's oath-taking ceremony on tuesday .",washington be brace itself for unprecedented crowd arrive for tuesday 's inauguration .,0.7407407407407407,12,24-12 7-0 11-6 8-4 23-9 10-5,,,,,,,
